{"$schema":"https://json-schema.org/draft/2020-12/schema","type":"object","additionalProperties":false,"required":["schema_version","status","purpose","components","analysis_bindings","controls"],"properties":{"schema_version":{"const":"biomedical-source-preparation-matrix-v1"},"status":{"const":"governance_only_no_payload_or_empirical_authority"},"purpose":{"type":"string","minLength":1},"components":{"type":"array","minItems":22,"maxItems":22,"items":{"type":"object","additionalProperties":false,"required":["id","source_ref","role","hpo_connection","release","lineage","archive_route","next_gate"],"properties":{"id":{"type":"string","pattern":"^[a-z0-9-]+$"},"source_ref":{"type":"string"},"role":{"type":"string"},"hpo_connection":{"type":"string"},"release":{"type":"string"},"lineage":{"type":"string"},"archive_route":{"type":"string"},"next_gate":{"type":"string"}}}},"analysis_bindings":{"type":"array","minItems":5,"maxItems":5,"items":{"type":"object","additionalProperties":false,"required":["id","components","analysis"],"properties":{"id":{"pattern":"^P[1-5]$"},"components":{"type":"array","minItems":3,"uniqueItems":true,"items":{"type":"string"}},"analysis":{"type":"string"}}}},"controls":{"type":"object"}}}
