{
  "schema_version": "biomedical-source-preparation-matrix-v1",
  "status": "governance_only_no_payload_or_empirical_authority",
  "purpose": "Decompose the registry expansion families into individually governed upstream artifacts and make every requested HPO-adjacent source, mapping role, lineage, archive disposition and next gate explicit.",
  "components": [
    {"id":"maxo","source_ref":"maxo","role":"treatment_context","hpo_connection":"MAxO disease-treatment and phenotype-treatment relations","release":"2026-01-15","lineage":"maxo-hpo-treatment","archive_route":"public_after_checksum_attribution","next_gate":"pin artifact checksum and attribution"},
    {"id":"hpo-phenotype-hpoa","source_ref":"hpo-associations","role":"disease_phenotype_context","hpo_connection":"direct HPO disease annotation product with evidence, negation, frequency and onset","release":"match frozen HPO release","lineage":"hpo-annotation-products","archive_route":"metadata_only","next_gate":"pin version-matched file, checksum and annotation rights"},
    {"id":"hpo-genes-to-phenotype","source_ref":"hpo-associations","role":"gene_phenotype_context","hpo_connection":"direct HPO gene-to-phenotype association product","release":"match frozen HPO release","lineage":"hpo-annotation-products","archive_route":"metadata_only","next_gate":"pin version-matched file, checksum and annotation rights"},
    {"id":"hpo-phenotype-to-genes","source_ref":"hpo-associations","role":"phenotype_gene_context","hpo_connection":"direct HPO phenotype-to-gene association product","release":"match frozen HPO release","lineage":"hpo-annotation-products","archive_route":"metadata_only","next_gate":"pin version-matched file, checksum and annotation rights"},
    {"id":"maxo-disease-treatment-annotations","source_ref":"maxo-annotations","role":"treatment_phenotype_consistency","hpo_connection":"version-matched MAxO treatment annotations joined through governed disease and phenotype identifiers","release":"match frozen MAxO and HPO releases","lineage":"maxo-hpo-treatment","archive_route":"metadata_only","next_gate":"identify exact annotation artifact and file-level licence"},
    {"id":"cmo","source_ref":"rgd-measurement-stack","role":"measurement_object","hpo_connection":"measurement and analyte compositional validation","release":"2026-07-25","lineage":"rgd-measurement-stack","archive_route":"public_after_checksum","next_gate":"pin immutable artifact and checksum"},
    {"id":"mmo","source_ref":"rgd-measurement-stack","role":"measurement_method","hpo_connection":"method-sensitive phenotype validation and hard negatives","release":"2026-07-29","lineage":"rgd-measurement-stack","archive_route":"public_after_checksum","next_gate":"pin immutable artifact and checksum"},
    {"id":"xco","source_ref":"rgd-measurement-stack","role":"experimental_condition","hpo_connection":"condition-sensitive phenotype validation and hard negatives","release":"2026-07-29","lineage":"rgd-measurement-stack","archive_route":"public_after_checksum","next_gate":"pin immutable artifact and checksum"},
    {"id":"eco","source_ref":"eco-sepio","role":"evidence_type","hpo_connection":"evidence coding for source atoms and HPO association assertions","release":"2026-07-10","lineage":"evidence-provenance-model","archive_route":"public_after_checksum","next_gate":"pin immutable artifact and checksum"},
    {"id":"sepio","source_ref":"eco-sepio","role":"assertion_provenance","hpo_connection":"assertion, evidence-line, method, agent and lineage model","release":"2023-06-13","lineage":"evidence-provenance-model","archive_route":"public_after_checksum_attribution","next_gate":"pin immutable artifact and attribution"},
    {"id":"phenopackets","source_ref":"ga4gh-phenopackets","role":"evaluation_envelope","hpo_connection":"PhenotypicFeature OntologyClass uses HPO CURIEs","release":"2.0.0","lineage":"ga4gh-phenopackets-schema","archive_route":"public_after_commit_checksum","next_gate":"pin commit and verify schema-version compatibility"},
    {"id":"phenopacket-store","source_ref":"phenopacket-store","role":"downstream_benchmark","hpo_connection":"cases carry HPO-coded phenotypic features","release":"exact commit pending","lineage":"phenopacket-case-corpus","archive_route":"metadata_only","next_gate":"case-level provenance, leakage, de-identification and reuse audit"},
    {"id":"beacon","source_ref":"ga4gh-beacon","role":"cohort_discovery","hpo_connection":"semantic phenotype filters use HPO CURIEs","release":"2.2.0","lineage":"ga4gh-beacon-schema","archive_route":"public_schema_only_after_checksum","next_gate":"separate endpoint data, consent and access decisions"},
    {"id":"duo","source_ref":"ga4gh-duo","role":"data_use_governance","hpo_connection":"governs dataset eligibility for HPO-coded benchmarks and Beacon endpoints","release":"2021-02-23","lineage":"ga4gh-duo","archive_route":"metadata_only","next_gate":"verify file-level licence; never substitute for copyright or consent"},
    {"id":"wikidata-p3841","source_ref":"wikidata-hpo","role":"multilingual_candidate_context","hpo_connection":"Wikidata P3841 directly records HPO identifiers","release":"dump or revision freeze pending","lineage":"wikidata-community-hpo","archive_route":"metadata_only","next_gate":"freeze query/dump, statement revisions, ranks, references and qualifiers"},
    {"id":"disease-ontology-spanish","source_ref":"do-spanish","role":"spanish_disease_context","hpo_connection":"qualified DOID-to-HPO routes only","release":"exact monthly release pending","lineage":"disease-ontology-spanish","archive_route":"public_after_release_hash_licence","next_gate":"pin release, hash and authoritative licence evidence"},
    {"id":"nci-cancer-dictionary-en","source_ref":"nci-cancer-dictionaries","role":"oncology_register_context","hpo_connection":"English oncology and public-facing context; no inferred NCIt identity","release":"current page unpinned","lineage":"nci-cancer-dictionaries","archive_route":"metadata_only","next_gate":"establish identifier-bearing export and element-level reuse terms"},
    {"id":"nci-cancer-dictionary-es","source_ref":"nci-cancer-dictionaries","role":"spanish_oncology_register_context","hpo_connection":"Spanish oncology and public-facing context; no inferred pairing","release":"current page unpinned","lineage":"nci-cancer-dictionaries","archive_route":"metadata_only","next_gate":"establish identifier-bearing alignment and element-level reuse terms"},
    {"id":"elements-of-morphology","source_ref":"elements-of-morphology","role":"visual_dysmorphology_context","hpo_connection":"HPO-mapped dysmorphology images and descriptions","release":"authoritative version unresolved","lineage":"elements-of-morphology-hpo","archive_route":"metadata_only","next_gate":"resolve version plus separate text, image and mapping rights"},
    {"id":"geno","source_ref":"geno","role":"genotype_phenotype_validation","hpo_connection":"downstream genotype-to-phenotype relations and contradiction analysis","release":"2026-02-02","lineage":"geno-sepio","archive_route":"public_after_checksum_import_audit","next_gate":"pin artifact and distinguish imported language tags"},
    {"id":"oae","source_ref":"oae","role":"adverse_event_control","hpo_connection":"adverse-event versus constitutional-phenotype disambiguation","release":"1.2.54-2026-04-15","lineage":"adverse-event-context","archive_route":"public_after_checksum_import_audit","next_gate":"pin artifact and collapse MedDRA, RxNorm and PRO-CTCAE dependence"},
    {"id":"hancestro","source_ref":"hancestro","role":"population_bias_control","hpo_connection":"prevents language, geography, ancestry, ethnicity and population conflation","release":"exact release pending","lineage":"hancestro-efo-gwas","archive_route":"metadata_only","next_gate":"pin exact release and distinguish EFO-imported lineage"}
  ],
  "analysis_bindings": [
    {"id":"P1","components":["maxo","hpo-phenotype-hpoa","hpo-genes-to-phenotype","hpo-phenotype-to-genes","maxo-disease-treatment-annotations"],"analysis":"version-matched treatment and disease/gene context fidelity"},
    {"id":"P2","components":["cmo","mmo","xco","eco","sepio"],"analysis":"measurement hard negatives and provenance completeness"},
    {"id":"P3","components":["phenopackets","phenopacket-store","beacon","duo"],"analysis":"round-trip fidelity, downstream ranking and governed retrieval invariance"},
    {"id":"P4","components":["wikidata-p3841","disease-ontology-spanish","nci-cancer-dictionary-en","nci-cancer-dictionary-es","elements-of-morphology"],"analysis":"multilingual coverage, register, provenance and visual-semantic error analysis"},
    {"id":"P5","components":["geno","oae","hancestro"],"analysis":"downstream contradiction, adverse-event and population-bias controls"}
  ],
  "controls": {"payload_retrieval_authorized":false,"archive_upload_authorized":false,"empirical_execution_authorized":false,"translation_vote_authorized":false,"automatic_promotion_allowed":false,"upstream_write_authorized":false,"new_freeze_required":true}
}
